{
  "$schema": "../../../content/schemas/constructions.schema.json",
  "version": "1.0.0",
  "_comment": "All workshops - built on-site from materials",
  "constructions": [
    {
      "_comment": "=== MINING WORKSHOPS ===",
      "id": "core_construction_workshop_miner",
      "name": "Miner Workshop",
      "category": "workshop",
      "tags": [
        "workshop",
        "mining",
        "excavation"
      ],
      "build_time_ticks": 1200,
      "placeable_profile": {
        "footprint": {
          "w": 5,
          "d": 5,
          "h": 1
        },
        "passability": "nonblocking",
        "requires_floor": true,
        "clearance_h": 3,
        "blocks_light": false,
        "tags": [
          "workshop",
          "mining"
        ],
        "effects": {
          "beauty": -1,
          "comfort": 0,
          "light_lumen": 0,
          "heat_w": 0
        }
      },
      "material_costs": [
        {
          "tag": "stone_block",
          "count": 20
        },
        {
          "tag": "wood_log",
          "count": 10
        }
      ],
      "skill_required": "construction"
    },
    {
      "id": "core_construction_workshop_metallurgy_smeltery",
      "name": "Metallurgy Smeltery",
      "category": "workshop",
      "tags": [
        "workshop",
        "mining",
        "smelting",
        "metallurgy"
      ],
      "build_time_ticks": 1500,
      "placeable_profile": {
        "footprint": {
          "w": 5,
          "d": 5,
          "h": 1
        },
        "passability": "nonblocking",
        "requires_floor": true,
        "clearance_h": 3,
        "blocks_light": false,
        "tags": [
          "workshop",
          "smelting",
          "hot"
        ],
        "effects": {
          "beauty": -2,
          "comfort": 0,
          "light_lumen": 200,
          "heat_w": 500
        }
      },
      "material_costs": [
        {
          "tag": "stone_block",
          "count": 30
        },
        {
          "tag": "clay_brick",
          "count": 20
        }
      ],
      "skill_required": "construction"
    },
    {
      "id": "core_construction_workshop_fuel_alkali_works",
      "name": "Fuel & Alkali Works",
      "category": "workshop",
      "tags": [
        "workshop",
        "mining",
        "fuel",
        "alkali",
        "charcoal"
      ],
      "build_time_ticks": 1400,
      "placeable_profile": {
        "footprint": {
          "w": 5,
          "d": 5,
          "h": 1
        },
        "passability": "nonblocking",
        "requires_floor": true,
        "clearance_h": 3,
        "blocks_light": false,
        "tags": [
          "workshop",
          "fuel",
          "charcoal"
        ],
        "effects": {
          "beauty": -3,
          "comfort": 0,
          "light_lumen": 100,
          "heat_w": 300
        }
      },
      "material_costs": [
        {
          "tag": "stone_block",
          "count": 25
        },
        {
          "tag": "wood_log",
          "count": 15
        }
      ],
      "skill_required": "construction"
    },
    {
      "id": "core_construction_workshop_lime_concrete_yard",
      "name": "Lime & Concrete Yard",
      "category": "workshop",
      "tags": [
        "workshop",
        "mining",
        "lime",
        "concrete",
        "construction"
      ],
      "build_time_ticks": 1300,
      "placeable_profile": {
        "footprint": {
          "w": 5,
          "d": 5,
          "h": 1
        },
        "passability": "nonblocking",
        "requires_floor": true,
        "clearance_h": 3,
        "blocks_light": false,
        "tags": [
          "workshop",
          "lime",
          "concrete"
        ],
        "effects": {
          "beauty": -2,
          "comfort": 0,
          "light_lumen": 0,
          "heat_w": 200
        }
      },
      "material_costs": [
        {
          "tag": "stone_block",
          "count": 20
        },
        {
          "tag": "wood_log",
          "count": 10
        }
      ],
      "skill_required": "construction"
    },
    {
      "_comment": "=== LUMBERING WORKSHOPS ===",
      "id": "core_construction_workshop_logging",
      "name": "Logging Hut",
      "category": "workshop",
      "tags": [
        "workshop",
        "lumbering",
        "logging",
        "wood"
      ],
      "build_time_ticks": 1000,
      "placeable_profile": {
        "footprint": {
          "w": 5,
          "d": 5,
          "h": 1
        },
        "passability": "nonblocking",
        "requires_floor": true,
        "clearance_h": 3,
        "blocks_light": false,
        "tags": [
          "workshop",
          "logging"
        ],
        "effects": {
          "beauty": 0,
          "comfort": 0,
          "light_lumen": 0,
          "heat_w": 0
        }
      },
      "material_costs": [
        {
          "tag": "wood_log",
          "count": 25
        },
        {
          "tag": "stone_block",
          "count": 10
        }
      ],
      "skill_required": "construction"
    },
    {
      "_comment": "=== FARMING WORKSHOPS ===",
      "id": "core_construction_workshop_agri_brew_works",
      "name": "Agriculture & Brewing Workshop",
      "category": "workshop",
      "tags": [
        "workshop",
        "farming",
        "agriculture",
        "brewing"
      ],
      "build_time_ticks": 1100,
      "placeable_profile": {
        "footprint": {
          "w": 5,
          "d": 5,
          "h": 1
        },
        "passability": "nonblocking",
        "requires_floor": true,
        "clearance_h": 3,
        "blocks_light": false,
        "tags": [
          "workshop",
          "farming",
          "brewing"
        ],
        "effects": {
          "beauty": 0,
          "comfort": 0,
          "light_lumen": 0,
          "heat_w": 100
        }
      },
      "material_costs": [
        {
          "tag": "wood_log",
          "count": 20
        },
        {
          "tag": "stone_block",
          "count": 15
        }
      ],
      "skill_required": "construction"
    },
    {
      "id": "core_construction_workshop_butchery",
      "name": "Butchery",
      "category": "workshop",
      "tags": [
        "workshop",
        "farming",
        "butchery",
        "meat"
      ],
      "build_time_ticks": 1100,
      "placeable_profile": {
        "footprint": {
          "w": 5,
          "d": 5,
          "h": 1
        },
        "passability": "nonblocking",
        "requires_floor": true,
        "clearance_h": 3,
        "blocks_light": false,
        "tags": [
          "workshop",
          "butchery"
        ],
        "effects": {
          "beauty": -3,
          "comfort": 0,
          "light_lumen": 0,
          "heat_w": 0
        }
      },
      "material_costs": [
        {
          "tag": "wood_log",
          "count": 20
        },
        {
          "tag": "stone_block",
          "count": 15
        }
      ],
      "skill_required": "construction"
    },
    {
      "id": "core_construction_workshop_pasture_shed",
      "name": "Pasture Shed",
      "category": "workshop",
      "tags": [
        "workshop",
        "farming",
        "pasture",
        "animal"
      ],
      "build_time_ticks": 900,
      "placeable_profile": {
        "footprint": {
          "w": 5,
          "d": 5,
          "h": 1
        },
        "passability": "nonblocking",
        "requires_floor": true,
        "clearance_h": 3,
        "blocks_light": false,
        "tags": [
          "workshop",
          "pasture",
          "animal"
        ],
        "effects": {
          "beauty": -2,
          "comfort": 0,
          "light_lumen": 0,
          "heat_w": 0
        }
      },
      "material_costs": [
        {
          "tag": "wood_log",
          "count": 30
        },
        {
          "tag": "rope",
          "count": 5
        }
      ],
      "skill_required": "construction"
    },
    {
      "id": "core_construction_workshop_tannery",
      "name": "Tannery",
      "category": "workshop",
      "tags": [
        "workshop",
        "farming",
        "tannery",
        "leather"
      ],
      "build_time_ticks": 1100,
      "placeable_profile": {
        "footprint": {
          "w": 5,
          "d": 5,
          "h": 1
        },
        "passability": "nonblocking",
        "requires_floor": true,
        "clearance_h": 3,
        "blocks_light": false,
        "tags": [
          "workshop",
          "tanning"
        ],
        "effects": {
          "beauty": -4,
          "comfort": 0,
          "light_lumen": 0,
          "heat_w": 0
        }
      },
      "material_costs": [
        {
          "tag": "wood_log",
          "count": 20
        },
        {
          "tag": "stone_block",
          "count": 10
        }
      ],
      "skill_required": "construction"
    },
    {
      "id": "core_construction_workshop_kitchen",
      "name": "Kitchen",
      "category": "workshop",
      "tags": [
        "workshop",
        "farming",
        "kitchen",
        "cooking"
      ],
      "build_time_ticks": 1200,
      "placeable_profile": {
        "footprint": {
          "w": 5,
          "d": 5,
          "h": 1
        },
        "passability": "nonblocking",
        "requires_floor": true,
        "clearance_h": 3,
        "blocks_light": false,
        "tags": [
          "workshop",
          "kitchen",
          "cooking"
        ],
        "effects": {
          "beauty": 1,
          "comfort": 1,
          "light_lumen": 100,
          "heat_w": 300
        }
      },
      "material_costs": [
        {
          "tag": "stone_block",
          "count": 20
        },
        {
          "tag": "wood_log",
          "count": 15
        },
        {
          "tag": "clay_brick",
          "count": 10
        }
      ],
      "skill_required": "construction"
    },
    {
      "id": "core_construction_workshop_compost",
      "name": "Compost Yard",